{
  "schema": 1,
  "id": "color-matrices",
  "purpose": "The D65 colour matrix of each Sony body, for the Before view (the photo as the camera would render it by default). Not used by the final picture, whose colour comes from the spectral profiles.",
  "provenance": "Numbers from the bodies' published D65 colour matrices (docs/14-licensing.md rule 8: numbers only, no table layout or text from the publishing project). Read for each body by its Sony model ID.",
  "matrix": "xyz_d65_to_camera: 3x3, rows are the camera R, G, B responses to CIE XYZ under D65, as published. The loader scales each row so that D65 white maps to camera [1, 1, 1] and inverts it (ym_color::camera_default).",
  "fallback": "ILCE-7RM4",
  "fallback_note": "A body that is not listed, or has no Sony model ID and an unknown model string, uses the fallback entry, as the profile registry falls back to the A7R IV profile.",
  "excluded": [
    {"model": "ILCE-7M5", "model_id": 407, "reason": "no published matrix of its own; a lookup returns another body's"},
    {"model": "ILCE-7RM6", "model_id": 410, "reason": "no published matrix of its own; a lookup returns another body's"}
  ],
  "bodies": [
    {
      "model_id": 261,
      "model": "DSLR-A300",
      "xyz_d65_to_camera": [
        [0.9847, -0.3091, -0.0928],
        [-0.8485, 1.6345, 0.2225],
        [-0.0715, 0.0595, 0.7103]
      ]
    },
    {
      "model_id": 274,
      "model": "DSLR-A500",
      "xyz_d65_to_camera": [
        [0.6046, -0.1127, -0.0278],
        [-0.5574, 1.3076, 0.2786],
        [-0.0691, 0.1419, 0.7625]
      ]
    },
    {
      "model_id": 288,
      "model": "NEX-5N",
      "xyz_d65_to_camera": [
        [0.5991, -0.1456, -0.0455],
        [-0.4764, 1.2135, 0.298],
        [-0.0707, 0.1425, 0.6701]
      ]
    },
    {
      "model_id": 289,
      "model": "NEX-7",
      "xyz_d65_to_camera": [
        [0.5491, -0.1192, -0.0363],
        [-0.4951, 1.2342, 0.2948],
        [-0.0911, 0.1722, 0.7192]
      ]
    },
    {
      "model_id": 295,
      "model": "NEX-6",
      "xyz_d65_to_camera": [
        [0.6129, -0.1545, -0.0418],
        [-0.493, 1.249, 0.2743],
        [-0.0977, 0.1693, 0.6615]
      ]
    },
    {
      "model_id": 296,
      "model": "NEX-5R",
      "xyz_d65_to_camera": [
        [0.6129, -0.1545, -0.0418],
        [-0.493, 1.249, 0.2743],
        [-0.0977, 0.1693, 0.6615]
      ]
    },
    {
      "model_id": 302,
      "model": "ILCE-3000",
      "note": "No published matrix of its own; the generic E-mount matrix (the numbers the published tables give an E-mount body without its own entry, the same as the NEX-5N's), owner's decision 2026-10-16. Sony writes the same model ID for the ILCE-3500.",
      "xyz_d65_to_camera": [
        [0.5991, -0.1456, -0.0455],
        [-0.4764, 1.2135, 0.298],
        [-0.0707, 0.1425, 0.6701]
      ]
    },
    {
      "model_id": 305,
      "model": "NEX-3N",
      "xyz_d65_to_camera": [
        [0.6129, -0.1545, -0.0418],
        [-0.493, 1.249, 0.2743],
        [-0.0977, 0.1693, 0.6615]
      ]
    },
    {
      "model_id": 306,
      "model": "ILCE-7",
      "xyz_d65_to_camera": [
        [0.5271, -0.0712, -0.0347],
        [-0.6153, 1.3653, 0.2763],
        [-0.1601, 0.2366, 0.7242]
      ]
    },
    {
      "model_id": 307,
      "model": "NEX-5T",
      "xyz_d65_to_camera": [
        [0.6129, -0.1545, -0.0418],
        [-0.493, 1.249, 0.2743],
        [-0.0977, 0.1693, 0.6615]
      ]
    },
    {
      "model_id": 311,
      "model": "ILCE-7R",
      "xyz_d65_to_camera": [
        [0.4913, -0.0541, -0.0202],
        [-0.613, 1.3513, 0.2906],
        [-0.1564, 0.2151, 0.7183]
      ]
    },
    {
      "model_id": 312,
      "model": "ILCE-6000",
      "xyz_d65_to_camera": [
        [0.5991, -0.1456, -0.0455],
        [-0.4764, 1.2135, 0.298],
        [-0.0707, 0.1425, 0.6701]
      ]
    },
    {
      "model_id": 313,
      "model": "ILCE-5000",
      "xyz_d65_to_camera": [
        [0.5991, -0.1456, -0.0455],
        [-0.4764, 1.2135, 0.298],
        [-0.0707, 0.1425, 0.6701]
      ]
    },
    {
      "model_id": 318,
      "model": "ILCE-7S",
      "xyz_d65_to_camera": [
        [0.5838, -0.143, -0.0246],
        [-0.3497, 1.1477, 0.2297],
        [-0.0748, 0.1885, 0.5778]
      ]
    },
    {
      "model_id": 339,
      "model": "ILCE-5100",
      "xyz_d65_to_camera": [
        [0.5991, -0.1456, -0.0455],
        [-0.4764, 1.2135, 0.298],
        [-0.0707, 0.1425, 0.6701]
      ]
    },
    {
      "model_id": 340,
      "model": "ILCE-7M2",
      "xyz_d65_to_camera": [
        [0.5271, -0.0712, -0.0347],
        [-0.6153, 1.3653, 0.2763],
        [-0.1601, 0.2366, 0.7242]
      ]
    },
    {
      "model_id": 341,
      "model": "DSC-RX100M4",
      "xyz_d65_to_camera": [
        [0.6596, -0.2079, -0.0562],
        [-0.4782, 1.3016, 0.1933],
        [-0.097, 0.1581, 0.5181]
      ]
    },
    {
      "model_id": 347,
      "model": "ILCE-7RM2",
      "xyz_d65_to_camera": [
        [0.6629, -0.19, -0.0483],
        [-0.4618, 1.2349, 0.255],
        [-0.0622, 0.1381, 0.6514]
      ]
    },
    {
      "model_id": 350,
      "model": "ILCE-7SM2",
      "xyz_d65_to_camera": [
        [0.5838, -0.143, -0.0246],
        [-0.3497, 1.1477, 0.2297],
        [-0.0748, 0.1885, 0.5778]
      ]
    },
    {
      "model_id": 357,
      "model": "ILCE-6300",
      "xyz_d65_to_camera": [
        [0.5973, -0.1695, -0.0419],
        [-0.3826, 1.1797, 0.2293],
        [-0.0639, 0.1398, 0.5789]
      ]
    },
    {
      "model_id": 358,
      "model": "ILCE-9",
      "xyz_d65_to_camera": [
        [0.6389, -0.1703, -0.0378],
        [-0.4562, 1.2265, 0.2587],
        [-0.067, 0.1489, 0.655]
      ]
    },
    {
      "model_id": 360,
      "model": "ILCE-6500",
      "xyz_d65_to_camera": [
        [0.5973, -0.1695, -0.0419],
        [-0.3826, 1.1797, 0.2293],
        [-0.0639, 0.1398, 0.5789]
      ]
    },
    {
      "model_id": 362,
      "model": "ILCE-7RM3",
      "xyz_d65_to_camera": [
        [0.664, -0.1847, -0.0503],
        [-0.5238, 1.301, 0.2474],
        [-0.0993, 0.1673, 0.6527]
      ]
    },
    {
      "model_id": 363,
      "model": "ILCE-7M3",
      "xyz_d65_to_camera": [
        [0.7374, -0.2389, -0.0551],
        [-0.5435, 1.3162, 0.2519],
        [-0.1006, 0.1795, 0.6552]
      ]
    },
    {
      "model_id": 371,
      "model": "ILCE-6400",
      "xyz_d65_to_camera": [
        [0.7657, -0.2847, -0.0607],
        [-0.4083, 1.1966, 0.2389],
        [-0.0684, 0.1418, 0.5844]
      ]
    },
    {
      "model_id": 375,
      "model": "ILCE-7RM4",
      "xyz_d65_to_camera": [
        [0.7662, -0.2686, -0.066],
        [-0.524, 1.2965, 0.253],
        [-0.0796, 0.1508, 0.6167]
      ]
    },
    {
      "model_id": 376,
      "model": "ILCE-9M2",
      "xyz_d65_to_camera": [
        [0.6389, -0.1703, -0.0378],
        [-0.4562, 1.2265, 0.2587],
        [-0.067, 0.1489, 0.655]
      ]
    },
    {
      "model_id": 378,
      "model": "ILCE-6600",
      "xyz_d65_to_camera": [
        [0.7657, -0.2847, -0.0607],
        [-0.4083, 1.1966, 0.2389],
        [-0.0684, 0.1418, 0.5844]
      ]
    },
    {
      "model_id": 379,
      "model": "ILCE-6100",
      "xyz_d65_to_camera": [
        [0.7657, -0.2847, -0.0607],
        [-0.4083, 1.1966, 0.2389],
        [-0.0684, 0.1418, 0.5844]
      ]
    },
    {
      "model_id": 381,
      "model": "ILCE-7C",
      "xyz_d65_to_camera": [
        [0.7374, -0.2389, -0.0551],
        [-0.5435, 1.3162, 0.2519],
        [-0.1006, 0.1795, 0.6552]
      ]
    },
    {
      "model_id": 383,
      "model": "ILCE-7SM3",
      "xyz_d65_to_camera": [
        [0.6912, -0.2127, -0.0469],
        [-0.447, 1.2175, 0.2587],
        [-0.0398, 0.1478, 0.6492]
      ]
    },
    {
      "model_id": 384,
      "model": "ILCE-1",
      "xyz_d65_to_camera": [
        [0.8161, -0.2947, -0.0739],
        [-0.4811, 1.2668, 0.2389],
        [-0.0437, 0.1229, 0.6524]
      ]
    },
    {
      "model_id": 385,
      "model": "ILME-FX3",
      "xyz_d65_to_camera": [
        [0.6912, -0.2127, -0.0469],
        [-0.447, 1.2175, 0.2587],
        [-0.0398, 0.1478, 0.6492]
      ]
    },
    {
      "model_id": 386,
      "model": "ILCE-7RM3A",
      "xyz_d65_to_camera": [
        [0.664, -0.1847, -0.0503],
        [-0.5238, 1.301, 0.2474],
        [-0.0993, 0.1673, 0.6527]
      ]
    },
    {
      "model_id": 387,
      "model": "ILCE-7RM4A",
      "xyz_d65_to_camera": [
        [0.7662, -0.2686, -0.066],
        [-0.524, 1.2965, 0.253],
        [-0.0796, 0.1508, 0.6167]
      ]
    },
    {
      "model_id": 388,
      "model": "ILCE-7M4",
      "xyz_d65_to_camera": [
        [0.746, -0.2365, -0.0588],
        [-0.5687, 1.3442, 0.2474],
        [-0.0624, 0.1156, 0.6584]
      ]
    },
    {
      "model_id": 390,
      "model": "ILCE-7RM5",
      "xyz_d65_to_camera": [
        [0.82, -0.2976, -0.0719],
        [-0.4296, 1.2053, 0.2532],
        [-0.0429, 0.1282, 0.5774]
      ]
    },
    {
      "model_id": 392,
      "model": "ILCE-9M3",
      "xyz_d65_to_camera": [
        [0.9811, -0.3908, -0.0752],
        [-0.3704, 1.1577, 0.2417],
        [-0.0073, 0.095, 0.598]
      ]
    },
    {
      "model_id": 393,
      "model": "ZV-E1",
      "xyz_d65_to_camera": [
        [0.6912, -0.2127, -0.0469],
        [-0.447, 1.2175, 0.2587],
        [-0.0398, 0.1478, 0.6492]
      ]
    },
    {
      "model_id": 396,
      "model": "ILCE-7CR",
      "xyz_d65_to_camera": [
        [0.82, -0.2976, -0.0719],
        [-0.4296, 1.2053, 0.2532],
        [-0.0429, 0.1282, 0.5774]
      ]
    },
    {
      "model_id": 397,
      "model": "ILCE-7CM2",
      "xyz_d65_to_camera": [
        [0.746, -0.2365, -0.0588],
        [-0.5687, 1.3442, 0.2474],
        [-0.0624, 0.1156, 0.6584]
      ]
    },
    {
      "model_id": 400,
      "model": "ILCE-1M2",
      "note": "Same sensor as the ILCE-1, so the ILCE-1's numbers; owner's decision 2026-10-16.",
      "xyz_d65_to_camera": [